Sheet: Sheet1
A1: \[66;70] | B1: 68 | C1: 4 | D1: 0.04 | F1: of:=[.D1]/4 -> 0.01 | H1: of:=COM.MICROSOFT.NORM.DIST([.B1];[.$F$26];[.$F$27];0) -> 0.00433189132965219 | I1: of:=COM.MICROSOFT.NORM.DIST([.$B1];[.$F$26];[.$F$27];0) -> 0.00433189132965219 | J1: of:=COM.MICROSOFT.NORM.DIST([.$B1];[.$F$26];[.$F$27];1) -> 0.0143394789445472 | K1: of:=SUM([.$D$1:.D1]) -> 0.04 | L1: of:=PHI(([.B1]-[.$F$26])/[.$F$27]) -> 0.0364312060823749
A2: (70;74] | B2: 72 | C2: 3 | D2: 0.03 | F2: of:=[.D2]/4 -> 0.0075 | H2: of:=COM.MICROSOFT.NORM.DIST([.B2] + 2;[.$F$26];[.$F$27];0) -> 0.0159972318501019 | I2: of:=COM.MICROSOFT.NORM.DIST([.$B2];[.$F$26];[.$F$27];0) -> 0.0109517561398243 | J2: of:=COM.MICROSOFT.NORM.DIST([.$B2];[.$F$26];[.$F$27];1) -> 0.0434255497536727 | K2: of:=SUM([.$D$1:.D2]) -> 0.07 | L2: of:=PHI(([.B2]-[.$F$26])/[.$F$27]) -> 0.0921042691359223
A3: (74;78] | B3: 76 | C3: 7 | D3: 0.07 | F3: of:=[.D3]/4 -> 0.0175 | H3: of:=COM.MICROSOFT.NORM.DIST([.B3] + 2;[.$F$26];[.$F$27];0) -> 0.0288059978892472 | I3: of:=COM.MICROSOFT.NORM.DIST([.$B3];[.$F$26];[.$F$27];0) -> 0.0220823128798053 | J3: of:=COM.MICROSOFT.NORM.DIST([.$B3];[.$F$26];[.$F$27];1) -> 0.108113525931953 | K3: of:=SUM([.$D$1:.D3]) -> 0.14 | L3: of:=PHI(([.B3]-[.$F$26])/[.$F$27]) -> 0.185712251319163
A4: (78;82] | B4: 80 | C4: 16 | D4: 0.16 | F4: of:=[.D4]/4 -> 0.04 | H4: of:=COM.MICROSOFT.NORM.DIST([.B4] + 2;[.$F$26];[.$F$27];0) -> 0.0413690542485813 | I4: of:=COM.MICROSOFT.NORM.DIST([.$B4];[.$F$26];[.$F$27];0) -> 0.0355107574261528 | J4: of:=COM.MICROSOFT.NORM.DIST([.$B4];[.$F$26];[.$F$27];1) -> 0.223328888731769 | K4: of:=SUM([.$D$1:.D4]) -> 0.3 | L4: of:=PHI(([.B4]-[.$F$26])/[.$F$27]) -> 0.298645469953945
A5: (82;86] | B5: 84 | C5: 18 | D5: 0.18 | F5: of:=[.D5]/4 -> 0.045 | H5: of:=COM.MICROSOFT.NORM.DIST([.B5] + 2;[.$F$26];[.$F$27];0) -> 0.0473830315117128 | I5: of:=COM.MICROSOFT.NORM.DIST([.$B5];[.$F$26];[.$F$27];0) -> 0.045543866195536 | J5: of:=COM.MICROSOFT.NORM.DIST([.$B5];[.$F$26];[.$F$27];1) -> 0.387678600119806 | K5: of:=SUM([.$D$1:.D5]) -> 0.48 | L5: of:=PHI(([.B5]-[.$F$26])/[.$F$27]) -> 0.383023914704458
A6: (86;90] | B6: 88 | C6: 20 | D6: 0.2 | F6: of:=[.D6]/4 -> 0.05 | H6: of:=COM.MICROSOFT.NORM.DIST([.B6] + 2;[.$F$26];[.$F$27];0) -> 0.043283729667939 | I6: of:=COM.MICROSOFT.NORM.DIST([.$B6];[.$F$26];[.$F$27];0) -> 0.0465858942633213 | J6: of:=COM.MICROSOFT.NORM.DIST([.$B6];[.$F$26];[.$F$27];1) -> 0.575443267435527 | K6: of:=SUM([.$D$1:.D6]) -> 0.68 | L6: of:=PHI(([.B6]-[.$F$26])/[.$F$27]) -> 0.391787370754532
A7: (90;94] | B7: 92 | C7: 15 | D7: 0.15 | F7: of:=[.D7]/4 -> 0.0375 | H7: of:=COM.MICROSOFT.NORM.DIST([.B7] + 2;[.$F$26];[.$F$27];0) -> 0.031534147269281 | I7: of:=COM.MICROSOFT.NORM.DIST([.$B7];[.$F$26];[.$F$27];0) -> 0.0380043720393225 | J7: of:=COM.MICROSOFT.NORM.DIST([.$B7];[.$F$26];[.$F$27];1) -> 0.747254166855383 | K7: of:=SUM([.$D$1:.D7]) -> 0.83 | L7: of:=PHI(([.B7]-[.$F$26])/[.$F$27]) -> 0.319616768850702
A8: (94;98] | B8: 96 | C8: 7 | D8: 0.07 | F8: of:=[.D8]/4 -> 0.0175 | H8: of:=COM.MICROSOFT.NORM.DIST([.B8] + 2;[.$F$26];[.$F$27];0) -> 0.0183228104828998 | I8: of:=COM.MICROSOFT.NORM.DIST([.$B8];[.$F$26];[.$F$27];0) -> 0.0247267630851969 | J8: of:=COM.MICROSOFT.NORM.DIST([.$B8];[.$F$26];[.$F$27];1) -> 0.873168673101653 | K8: of:=SUM([.$D$1:.D8]) -> 0.9 | L8: of:=PHI(([.B8]-[.$F$26])/[.$F$27]) -> 0.207952077546506
A9: (98;102] | B9: 100 | C9: 6 | D9: 0.06 | F9: of:=[.D9]/4 -> 0.015 | H9: of:=COM.MICROSOFT.NORM.DIST([.B9] + 2;[.$F$26];[.$F$27];0) -> 0.00849097711295573 | I9: of:=COM.MICROSOFT.NORM.DIST([.$B9];[.$F$26];[.$F$27];0) -> 0.0128308538190573 | J9: of:=COM.MICROSOFT.NORM.DIST([.$B9];[.$F$26];[.$F$27];1) -> 0.947074076633432 | K9: of:=SUM([.$D$1:.D9]) -> 0.96 | L9: of:=PHI(([.B9]-[.$F$26])/[.$F$27]) -> 0.107907480618272
A10: (102;106] | B10: 104 | C10: 4 | D10: 0.04 | F10: of:=[.D10]/4 -> 0.01 | H10: of:=COM.MICROSOFT.NORM.DIST([.B10] + 2;[.$F$26];[.$F$27];0) -> 0.00313817987848851 | I10: of:=COM.MICROSOFT.NORM.DIST([.$B10];[.$F$26];[.$F$27];0) -> 0.00531004778172815 | J10: of:=COM.MICROSOFT.NORM.DIST([.$B10];[.$F$26];[.$F$27];1) -> 0.981814115317456 | K10: of:=SUM([.$D$1:.D10]) -> 1 | L10: of:=PHI(([.B10]-[.$F$26])/[.$F$27]) -> 0.0446575018443338
L14: of:=PHI(3) -> 0.00443184841193801
A15: x | B15: F^*(X)
A16: 70 | B16: of:=[.D1] -> 0.04 | H16: f_max = f(a) = f(86.4)
A17: 74 | B17: of:=[.B16]+[.D2] -> 0.07
A18: 78 | B18: of:=[.B17]+[.D3] -> 0.14
A19: 82 | B19: of:=[.B18]+[.D4] -> 0.3 | E19: \overline X_B | F19: of:=SUMPRODUCT([.B1:.B10];[.D1:.D10]) -> 86.4
A20: 86 | B20: of:=[.B19]+[.D5] -> 0.48 | E20: D_B | F20: of:=SUMPRODUCT([.B1:.B10];[.B1:.B10];[.D1:.D10]) - [.F19]^2 -> 70.079999999999
A21: 90 | B21: of:=[.B20]+[.D6] -> 0.68 | E21: \sigma _B | F21: of:=SQRT([.F20]) -> 8.37137981458248
A22: 94 | B22: of:=[.B21]+[.D7] -> 0.83
A23: 98 | B23: of:=[.B22]+[.D8] -> 0.9 | E23: D_ = s^2 | F23: of:=100/(100-1) * [.F20] -> 70.7878787878778
A24: 102 | B24: of:=[.B23]+[.D9] -> 0.96 | E24: \sigma _ = s | F24: of:=SQRT([.F23]) -> 8.41355327955305 | H24: F(x) = + Phi((x-a)/\sigma)
A25: 106 | B25: of:=[.B24]+[.D10] -> 1
E26: M[X] = a = \overline X_B | F26: of:=[.F19] -> 86.4
E27: \sigma = s | F27: 8.41

Sheet: Sheet2
F1: p_i x_i-1 x_i () | H1: n_i = n * p_i
A2: 66 | B2: 74 | C2: 70 | D2: 7 | F2: of:=COM.MICROSOFT.NORM.DIST([.$B2]; [Sheet1.$F$26]; [Sheet1.$F$27]; 1) - COM.MICROSOFT.NORM.DIST([.$A2]; [Sheet1.$F$26]; [Sheet1.$F$27]; 1) -> 0.0625424367971929 | H2: of:=100 * [.F2] -> 6.25424367971929
A3: 74 | B3: 78 | C3: 76 | D3: 7 | F3: of:=COM.MICROSOFT.NORM.DIST([.$B3]; [Sheet1.$F$26]; [Sheet1.$F$27]; 1) - COM.MICROSOFT.NORM.DIST([.$A3]; [Sheet1.$F$26]; [Sheet1.$F$27]; 1) -> 0.0887609159258773 | H3: of:=100 * [.F3] -> 8.87609159258773
A4: 78 | B4: 82 | C4: 80 | D4: 16 | F4: of:=COM.MICROSOFT.NORM.DIST([.$B4]; [Sheet1.$F$26]; [Sheet1.$F$27]; 1) - COM.MICROSOFT.NORM.DIST([.$A4]; [Sheet1.$F$26]; [Sheet1.$F$27]; 1) -> 0.141479031183499 | H4: of:=100 * [.F4] -> 14.1479031183499
A5: 82 | B5: 86 | C5: 84 | D5: 18 | F5: of:=COM.MICROSOFT.NORM.DIST([.$B5]; [Sheet1.$F$26]; [Sheet1.$F$27]; 1) - COM.MICROSOFT.NORM.DIST([.$A5]; [Sheet1.$F$26]; [Sheet1.$F$27]; 1) -> 0.180610315003177 | H5: of:=100 * [.F5] -> 18.0610315003177
A6: 86 | B6: 90 | C6: 88 | D6: 20 | F6: of:=COM.MICROSOFT.NORM.DIST([.$B6]; [Sheet1.$F$26]; [Sheet1.$F$27]; 1) - COM.MICROSOFT.NORM.DIST([.$A6]; [Sheet1.$F$26]; [Sheet1.$F$27]; 1) -> 0.184664458602799 | H6: of:=100 * [.F6] -> 18.4664458602799
A7: 90 | B7: 94 | C7: 92 | D7: 15 | F7: of:=COM.MICROSOFT.NORM.DIST([.$B7]; [Sheet1.$F$26]; [Sheet1.$F$27]; 1) - COM.MICROSOFT.NORM.DIST([.$A7]; [Sheet1.$F$26]; [Sheet1.$F$27]; 1) -> 0.151222113321984 | H7: of:=100 * [.F7] -> 15.1222113321984
A8: 94 | B8: 98 | C8: 96 | D8: 7 | F8: of:=COM.MICROSOFT.NORM.DIST([.$B8]; [Sheet1.$F$26]; [Sheet1.$F$27]; 1) - COM.MICROSOFT.NORM.DIST([.$A8]; [Sheet1.$F$26]; [Sheet1.$F$27]; 1) -> 0.0991813948573285 | H8: of:=100 * [.F8] -> 9.91813948573285
A9: 98 | B9: 106 | C9: 102 | D9: 10 | F9: of:=COM.MICROSOFT.NORM.DIST([.$B9]; [Sheet1.$F$26]; [Sheet1.$F$27]; 1) - COM.MICROSOFT.NORM.DIST([.$A9]; [Sheet1.$F$26]; [Sheet1.$F$27]; 1) -> 0.0740112276726308 | H9: of:=100 * [.F9] -> 7.40112276726308
A10: (102;106]
I14: of:=PHI(-3) -> 0.00443184841193801 | J14: of:=1 - [.I14] -> 0.995568151588062
I15: of:=PHI(3) -> 0.00443184841193801