Sheet: Sheet1
A1: Вид растений | B1: Масса (т) продуцируемого кислорода на 1 га растений в год | C1: Площадь насаждения (га) деревьев для продуцирования кислорода на 1 чел. в год | D1: Кол-во деревьев (шт) для продуцирования кислорода на 1 чел. в год
A2: Сосна | B2: 10.9 | C2: of:=[.$C$20]/[.B2] -> 0.109174311926606 | D2: of:=[.C2]*[.$C$21] -> 131.009174311927
A3: Дуб | B3: 27 | C3: of:=[.$C$20]/[.B3] -> 0.0440740740740741 | D3: of:=[.C3]*[.$C$21] -> 52.8888888888889
A4: Липа | B4: 11.6 | C4: of:=[.$C$20]/[.B4] -> 0.102586206896552 | D4: of:=[.C4]*[.$C$21] -> 123.103448275862
A5: Ель | B5: 12 | C5: of:=[.$C$20]/[.B5] -> 0.0991666666666667 | D5: of:=[.C5]*[.$C$21] -> 119
A6: Тополь | B6: 34.9 | C6: of:=[.$C$20]/[.B6] -> 0.0340974212034384 | D6: of:=[.C6]*[.$C$21] -> 40.9169054441261
A7: Лиственница | B7: 8 | C7: of:=[.$C$20]/[.B7] -> 0.14875 | D7: of:=[.C7]*[.$C$21] -> 178.5
A8: Клён | B8: 12.4 | C8: of:=[.$C$20]/[.B8] -> 0.0959677419354839 | D8: of:=[.C8]*[.$C$21] -> 115.161290322581
A9: Сирень | B9: 15.3 | C9: of:=[.$C$20]/[.B9] -> 0.0777777777777778 | D9: of:=[.C9]*[.$C$21] -> 93.3333333333333
A10: Осина | B10: 13 | C10: of:=[.$C$20]/[.B10] -> 0.0915384615384615 | D10: of:=[.C10]*[.$C$21] -> 109.846153846154
A11: Граб | B11: 12 | C11: of:=[.$C$20]/[.B11] -> 0.0991666666666667 | D11: of:=[.C11]*[.$C$21] -> 119
A12: Кедр | B12: 14.3 | C12: of:=[.$C$20]/[.B12] -> 0.0832167832167832 | D12: of:=[.C12]*[.$C$21] -> 99.8601398601399
A13: Ясень | B13: 11.9 | C13: of:=[.$C$20]/[.B13] -> 0.1 | D13: of:=[.C13]*[.$C$21] -> 120
A14: Лещина | B14: 12 | C14: of:=[.$C$20]/[.B14] -> 0.0991666666666667 | D14: of:=[.C14]*[.$C$21] -> 119
A15: Бук | B15: 11.5 | C15: of:=[.$C$20]/[.B15] -> 0.103478260869565 | D15: of:=[.C15]*[.$C$21] -> 124.173913043478
A16: Пихта | B16: 8.6 | C16: of:=[.$C$20]/[.B16] -> 0.138372093023256 | D16: of:=[.C16]*[.$C$21] -> 166.046511627907
A17: Берёза | B17: 20.7 | C17: of:=[.$C$20]/[.B17] -> 0.057487922705314 | D17: of:=[.C17]*[.$C$21] -> 68.9855072463768
A20: Потребление кислорода в год на 1 чел, т | C20: 1.19
A21: Плотность насаждений, шт/га | C21: 1200
A22: Население Забайкальского края, чел. | C22: 983838
A23: Население России, чел. | C23: 146119928

Sheet: Sheet1_2
A1: Вид растений | B1: Масса (т) продуцируемого кислорода на 1 га растений в год | C1: Площадь насаждения (га) деревьев для продуцирования кислорода на 1 чел. в год | D1: Площадь насаждения (га) деревьев для обеспечения кислородом населения Забайкальского края в год | E1: Площадь насаждения (га) деревьев для обеспечения кислородом населения России в год
A2: Сосна | B2: 10.9 | C2: of:=[.$C$20]/[.B2] -> 0.109174311926606 | D2: of:=[.$C$22]*[.$C2] -> 107409.836697248 | E2: of:=[.$C$23]*[.$C2] -> 15952542.5981651
A3: Дуб | B3: 27 | C3: of:=[.$C$20]/[.B3] -> 0.0440740740740741 | D3: of:=[.$C$22]*[.$C3] -> 43361.7488888889 | E3: of:=[.$C$23]*[.$C3] -> 6440100.53037037
A4: Липа | B4: 11.6 | C4: of:=[.$C$20]/[.B4] -> 0.102586206896552 | D4: of:=[.$C$22]*[.$C4] -> 100928.20862069 | E4: of:=[.$C$23]*[.$C4] -> 14989889.1655172
A5: Ель | B5: 12 | C5: of:=[.$C$20]/[.B5] -> 0.0991666666666667 | D5: of:=[.$C$22]*[.$C5] -> 97563.935 | E5: of:=[.$C$23]*[.$C5] -> 14490226.1933333
A6: Тополь | B6: 34.9 | C6: of:=[.$C$20]/[.B6] -> 0.0340974212034384 | D6: of:=[.$C$22]*[.$C6] -> 33546.3386819484 | E6: of:=[.$C$23]*[.$C6] -> 4982312.73123209
A7: Лиственница | B7: 8 | C7: of:=[.$C$20]/[.B7] -> 0.14875 | D7: of:=[.$C$22]*[.$C7] -> 146345.9025 | E7: of:=[.$C$23]*[.$C7] -> 21735339.29
A8: Клён | B8: 12.4 | C8: of:=[.$C$20]/[.B8] -> 0.0959677419354839 | D8: of:=[.$C$22]*[.$C8] -> 94416.7112903226 | E8: of:=[.$C$23]*[.$C8] -> 14022799.5419355
A9: Сирень | B9: 15.3 | C9: of:=[.$C$20]/[.B9] -> 0.0777777777777778 | D9: of:=[.$C$22]*[.$C9] -> 76520.7333333333 | E9: of:=[.$C$23]*[.$C9] -> 11364883.2888889
A10: Осина | B10: 13 | C10: of:=[.$C$20]/[.B10] -> 0.0915384615384615 | D10: of:=[.$C$22]*[.$C10] -> 90059.0169230769 | E10: of:=[.$C$23]*[.$C10] -> 13375593.4092308
A11: Граб | B11: 12 | C11: of:=[.$C$20]/[.B11] -> 0.0991666666666667 | D11: of:=[.$C$22]*[.$C11] -> 97563.935 | E11: of:=[.$C$23]*[.$C11] -> 14490226.1933333
A12: Кедр | B12: 14.3 | C12: of:=[.$C$20]/[.B12] -> 0.0832167832167832 | D12: of:=[.$C$22]*[.$C12] -> 81871.8335664336 | E12: of:=[.$C$23]*[.$C12] -> 12159630.372028
A13: Ясень | B13: 11.9 | C13: of:=[.$C$20]/[.B13] -> 0.1 | D13: of:=[.$C$22]*[.$C13] -> 98383.8 | E13: of:=[.$C$23]*[.$C13] -> 14611992.8
A14: Лещина | B14: 12 | C14: of:=[.$C$20]/[.B14] -> 0.0991666666666667 | D14: of:=[.$C$22]*[.$C14] -> 97563.935 | E14: of:=[.$C$23]*[.$C14] -> 14490226.1933333
A15: Бук | B15: 11.5 | C15: of:=[.$C$20]/[.B15] -> 0.103478260869565 | D15: of:=[.$C$22]*[.$C15] -> 101805.845217391 | E15: of:=[.$C$23]*[.$C15] -> 15120236.0278261
A16: Пихта | B16: 8.6 | C16: of:=[.$C$20]/[.B16] -> 0.138372093023256 | D16: of:=[.$C$22]*[.$C16] -> 136135.723255814 | E16: of:=[.$C$23]*[.$C16] -> 20218920.2697674
A17: Берёза | B17: 20.7 | C17: of:=[.$C$20]/[.B17] -> 0.057487922705314 | D17: of:=[.$C$22]*[.$C17] -> 56558.8028985507 | E17: of:=[.$C$23]*[.$C17] -> 8400131.12657005
A20: Потребление кислорода в год на 1 чел, т | C20: 1.19
A21: Плотность насаждений, шт/га | C21: 1200
A22: Население Забайкальского края, чел. | C22: 983838
A23: Население России, чел. | C23: 146119928