Sheet: Sheet1
B1: F | C1: x_м | E1: \alpha | F1: H
A2: тв | B2: 3 | C2: of:=(5-[.B2])/4 *[.$E$2] *[.$F$2] -> 145.4469010976 | E2: 18.1808626372 | F2: 16
A3: газ | B3: 1 | C3: of:=(5-[.B3])/4 *[.$E$2] *[.$F$2] -> 290.8938021952
A6: x_м | B6: of:=[.$C$2] -> 145.4469010976 | C6: of:=[.$C$3] -> 290.8938021952 | H6: С_м | I6: 0.08660165592 | J6: 0.0127106153 | K6: 0.0116111471 | L6: 0.0004027853
A7: x | B7: x/x_м тв | C7: x/x_м газ | E7: S_1тв | F7: S_1газ | H7: С | I7: тв | J7: SO_2 | K7: CO | L7: NO_2
A8: 50 | B8: of:=[.$A8]/[.B$6] -> 0.343768066714933 | C8: of:=[.$A8]/[.C$6] -> 0.171884033357466 | E8: of:=IF([.B8]<=1; 3*([.B8]^4)-8*[.B8]^3+6*[.B8]^2;1.13/(0.13*[.B8]^2+1)) -> 0.425953535409328 | F8: of:=IF([.C8]<=1; 3*([.C8]^4)-8*[.C8]^3+6*[.C8]^2;1.13/(0.13*[.C8]^2+1)) -> 0.139257989452478 | I8: of:=[.E8]*[.$I$6] -> 0.0368882815114261 | J8: of:=[.$F8]*[.J$6] -> 0.00177005473138191 | K8: of:=[.$F8]*[.K$6] -> 0.00161694500038298 | L8: of:=[.$F8]*[.L$6] -> 0.0000560910710590134
A9: 100 | B9: of:=[.$A9]/[.B$6] -> 0.687536133429866 | C9: of:=[.$A9]/[.C$6] -> 0.343768066714933 | E9: of:=IF([.B9]<=1; 3*([.B9]^4)-8*[.B9]^3+6*[.B9]^2;1.13/(0.13*[.B9]^2+1)) -> 0.906569025797047 | F9: of:=IF([.C9]<=1; 3*([.C9]^4)-8*[.C9]^3+6*[.C9]^2;1.13/(0.13*[.C9]^2+1)) -> 0.425953535409328 | I9: of:=[.E9]*[.$I$6] -> 0.0785103788398055 | J9: of:=[.$F9]*[.J$6] -> 0.00541413152426289 | K9: of:=[.$F9]*[.K$6] -> 0.00494580915740276 | L9: of:=[.$F9]*[.L$6] -> 0.000171567822545907
A10: 200 | B10: of:=[.$A10]/[.B$6] -> 1.37507226685973 | C10: of:=[.$A10]/[.C$6] -> 0.687536133429866 | E10: of:=IF([.B10]<=1; 3*([.B10]^4)-8*[.B10]^3+6*[.B10]^2;1.13/(0.13*[.B10]^2+1)) -> 0.907042520968834 | F10: of:=IF([.C10]<=1; 3*([.C10]^4)-8*[.C10]^3+6*[.C10]^2;1.13/(0.13*[.C10]^2+1)) -> 0.906569025797047 | I10: of:=[.E10]*[.$I$6] -> 0.0785513843057523 | J10: of:=[.$F10]*[.J$6] -> 0.011523050129802 | K10: of:=[.$F10]*[.K$6] -> 0.0105263063148332 | L10: of:=[.$F10]*[.L$6] -> 0.000365152677026372
A11: 400 | B11: of:=[.$A11]/[.B$6] -> 2.75014453371946 | C11: of:=[.$A11]/[.C$6] -> 1.37507226685973 | E11: of:=IF([.B11]<=1; 3*([.B11]^4)-8*[.B11]^3+6*[.B11]^2;1.13/(0.13*[.B11]^2+1)) -> 0.569778060722773 | F11: of:=IF([.C11]<=1; 3*([.C11]^4)-8*[.C11]^3+6*[.C11]^2;1.13/(0.13*[.C11]^2+1)) -> 0.907042520968834 | I11: of:=[.E11]*[.$I$6] -> 0.0493437235654784 | J11: of:=[.$F11]*[.J$6] -> 0.011529068544777 | K11: of:=[.$F11]*[.K$6] -> 0.010531804136924 | L11: of:=[.$F11]*[.L$6] -> 0.000365343393921188
A12: 1000 | B12: of:=[.$A12]/[.B$6] -> 6.87536133429866 | C12: of:=[.$A12]/[.C$6] -> 3.43768066714933 | E12: of:=IF([.B12]<=1; 3*([.B12]^4)-8*[.B12]^3+6*[.B12]^2;1.13/(0.13*[.B12]^2+1)) -> 0.158148633120824 | F12: of:=IF([.C12]<=1; 3*([.C12]^4)-8*[.C12]^3+6*[.C12]^2;1.13/(0.13*[.C12]^2+1)) -> 0.445531894836818 | I12: of:=[.E12]*[.$I$6] -> 0.0136959335097479 | J12: of:=[.$F12]*[.J$6] -> 0.00566298451915085 | K12: of:=[.$F12]*[.K$6] -> 0.00517313636869203 | L12: of:=[.$F12]*[.L$6] -> 0.000179453697921416