Sheet: Sheet4
B1: x | C1: y | D1: z | F1: k_1 | G1: k_2 | H1: k_3 | I1: k_{12} | J1: k_{13} | K1: k_{23} | L1: k_{123}
B2: 0 | C2: 0 | D2: 0 | F2: of:=[.F$1] & "^" & [.$B2] -> k_1^0 | G2: of:=[.G$1] & "^" & [.$C2] -> k_2^0 | H2: of:=[.H$1] & "^" & [.$D2] -> k_3^0 | I2: of:=[.I$1] & "^{" & [.$B2] & [.$C2] & "}" -> k_{12}^{00} | J2: of:=[.J$1] & "^{" & [.$B2] & [.$D2] & "}" -> k_{13}^{00} | K2: of:=[.K$1] & "^{" & [.$C2] & [.$D2] & "}" -> k_{23}^{00} | L2: of:=[.L$1] & "^{" & [.$B2] & [.$C2] & [.$D2] & "}" -> k_{123}^{000} | M2: 1
B3: 0 | C3: 0 | D3: 1 | F3: of:=[.F$1] & "^" & [.$B3] -> k_1^0 | G3: of:=[.G$1] & "^" & [.$C3] -> k_2^0 | H3: of:=[.H$1] & "^" & [.$D3] -> k_3^1 | I3: of:=[.I$1] & "^{" & [.$B3] & [.$C3] & "}" -> k_{12}^{00} | J3: of:=[.J$1] & "^{" & [.$B3] & [.$D3] & "}" -> k_{13}^{01} | K3: of:=[.K$1] & "^{" & [.$C3] & [.$D3] & "}" -> k_{23}^{01} | L3: of:=[.L$1] & "^{" & [.$B3] & [.$C3] & [.$D3] & "}" -> k_{123}^{001} | M3: 0
B4: 0 | C4: 1 | D4: 0 | F4: of:=[.F$1] & "^" & [.$B4] -> k_1^0 | G4: of:=[.G$1] & "^" & [.$C4] -> k_2^1 | H4: of:=[.H$1] & "^" & [.$D4] -> k_3^0 | I4: of:=[.I$1] & "^{" & [.$B4] & [.$C4] & "}" -> k_{12}^{01} | J4: of:=[.J$1] & "^{" & [.$B4] & [.$D4] & "}" -> k_{13}^{00} | K4: of:=[.K$1] & "^{" & [.$C4] & [.$D4] & "}" -> k_{23}^{10} | L4: of:=[.L$1] & "^{" & [.$B4] & [.$C4] & [.$D4] & "}" -> k_{123}^{010} | M4: 0
B5: 0 | C5: 1 | D5: 1 | F5: of:=[.F$1] & "^" & [.$B5] -> k_1^0 | G5: of:=[.G$1] & "^" & [.$C5] -> k_2^1 | H5: of:=[.H$1] & "^" & [.$D5] -> k_3^1 | I5: of:=[.I$1] & "^{" & [.$B5] & [.$C5] & "}" -> k_{12}^{01} | J5: of:=[.J$1] & "^{" & [.$B5] & [.$D5] & "}" -> k_{13}^{01} | K5: of:=[.K$1] & "^{" & [.$C5] & [.$D5] & "}" -> k_{23}^{11} | L5: of:=[.L$1] & "^{" & [.$B5] & [.$C5] & [.$D5] & "}" -> k_{123}^{011} | M5: 0
B6: 1 | C6: 0 | D6: 0 | F6: of:=[.F$1] & "^" & [.$B6] -> k_1^1 | G6: of:=[.G$1] & "^" & [.$C6] -> k_2^0 | H6: of:=[.H$1] & "^" & [.$D6] -> k_3^0 | I6: of:=[.I$1] & "^{" & [.$B6] & [.$C6] & "}" -> k_{12}^{10} | J6: of:=[.J$1] & "^{" & [.$B6] & [.$D6] & "}" -> k_{13}^{10} | K6: of:=[.K$1] & "^{" & [.$C6] & [.$D6] & "}" -> k_{23}^{00} | L6: of:=[.L$1] & "^{" & [.$B6] & [.$C6] & [.$D6] & "}" -> k_{123}^{100} | M6: 1
B7: 1 | C7: 0 | D7: 1 | F7: of:=[.F$1] & "^" & [.$B7] -> k_1^1 | G7: of:=[.G$1] & "^" & [.$C7] -> k_2^0 | H7: of:=[.H$1] & "^" & [.$D7] -> k_3^1 | I7: of:=[.I$1] & "^{" & [.$B7] & [.$C7] & "}" -> k_{12}^{10} | J7: of:=[.J$1] & "^{" & [.$B7] & [.$D7] & "}" -> k_{13}^{11} | K7: of:=[.K$1] & "^{" & [.$C7] & [.$D7] & "}" -> k_{23}^{01} | L7: of:=[.L$1] & "^{" & [.$B7] & [.$C7] & [.$D7] & "}" -> k_{123}^{101} | M7: 0
B8: 1 | C8: 1 | D8: 0 | F8: of:=[.F$1] & "^" & [.$B8] -> k_1^1 | G8: of:=[.G$1] & "^" & [.$C8] -> k_2^1 | H8: of:=[.H$1] & "^" & [.$D8] -> k_3^0 | I8: of:=[.I$1] & "^{" & [.$B8] & [.$C8] & "}" -> k_{12}^{11} | J8: of:=[.J$1] & "^{" & [.$B8] & [.$D8] & "}" -> k_{13}^{10} | K8: of:=[.K$1] & "^{" & [.$C8] & [.$D8] & "}" -> k_{23}^{10} | L8: of:=[.L$1] & "^{" & [.$B8] & [.$C8] & [.$D8] & "}" -> k_{123}^{110} | M8: 1
B9: 1 | C9: 1 | D9: 1 | F9: of:=[.F$1] & "^" & [.$B9] -> k_1^1 | G9: of:=[.G$1] & "^" & [.$C9] -> k_2^1 | H9: of:=[.H$1] & "^" & [.$D9] -> k_3^1 | I9: of:=[.I$1] & "^{" & [.$B9] & [.$C9] & "}" -> k_{12}^{11} | J9: of:=[.J$1] & "^{" & [.$B9] & [.$D9] & "}" -> k_{13}^{11} | K9: of:=[.K$1] & "^{" & [.$C9] & [.$D9] & "}" -> k_{23}^{11} | L9: of:=[.L$1] & "^{" & [.$B9] & [.$C9] & [.$D9] & "}" -> k_{123}^{111} | M9: 1
F12: of:=ORG.LIBREOFFICE.REGEX([.F2];"_|\^";" ";"g") -> k 1 0 | G12: of:=ORG.LIBREOFFICE.REGEX([.G2];"_|\^";" ";"g") -> k 2 0 | H12: of:=ORG.LIBREOFFICE.REGEX([.H2];"_|\^";" ";"g") -> k 3 0 | I12: of:=ORG.LIBREOFFICE.REGEX([.I2];"_|\^";" ";"g") -> k {12} {00} | J12: of:=ORG.LIBREOFFICE.REGEX([.J2];"_|\^";" ";"g") -> k {13} {00} | K12: of:=ORG.LIBREOFFICE.REGEX([.K2];"_|\^";" ";"g") -> k {23} {00} | L12: of:=ORG.LIBREOFFICE.REGEX([.L2];"_|\^";" ";"g") -> k {123} {000}
F13: of:=ORG.LIBREOFFICE.REGEX([.F3];"_|\^";" ";"g") -> k 1 0 | G13: of:=ORG.LIBREOFFICE.REGEX([.G3];"_|\^";" ";"g") -> k 2 0 | H13: of:=ORG.LIBREOFFICE.REGEX([.H3];"_|\^";" ";"g") -> k 3 1 | I13: of:=ORG.LIBREOFFICE.REGEX([.I3];"_|\^";" ";"g") -> k {12} {00} | J13: of:=ORG.LIBREOFFICE.REGEX([.J3];"_|\^";" ";"g") -> k {13} {01} | K13: of:=ORG.LIBREOFFICE.REGEX([.K3];"_|\^";" ";"g") -> k {23} {01} | L13: of:=ORG.LIBREOFFICE.REGEX([.L3];"_|\^";" ";"g") -> k {123} {001}
F14: of:=ORG.LIBREOFFICE.REGEX([.F4];"_|\^";" ";"g") -> k 1 0 | G14: of:=ORG.LIBREOFFICE.REGEX([.G4];"_|\^";" ";"g") -> k 2 1 | H14: of:=ORG.LIBREOFFICE.REGEX([.H4];"_|\^";" ";"g") -> k 3 0 | I14: of:=ORG.LIBREOFFICE.REGEX([.I4];"_|\^";" ";"g") -> k {12} {01} | J14: of:=ORG.LIBREOFFICE.REGEX([.J4];"_|\^";" ";"g") -> k {13} {00} | K14: of:=ORG.LIBREOFFICE.REGEX([.K4];"_|\^";" ";"g") -> k {23} {10} | L14: of:=ORG.LIBREOFFICE.REGEX([.L4];"_|\^";" ";"g") -> k {123} {010}
F15: of:=ORG.LIBREOFFICE.REGEX([.F5];"_|\^";" ";"g") -> k 1 0 | G15: of:=ORG.LIBREOFFICE.REGEX([.G5];"_|\^";" ";"g") -> k 2 1 | H15: of:=ORG.LIBREOFFICE.REGEX([.H5];"_|\^";" ";"g") -> k 3 1 | I15: of:=ORG.LIBREOFFICE.REGEX([.I5];"_|\^";" ";"g") -> k {12} {01} | J15: of:=ORG.LIBREOFFICE.REGEX([.J5];"_|\^";" ";"g") -> k {13} {01} | K15: of:=ORG.LIBREOFFICE.REGEX([.K5];"_|\^";" ";"g") -> k {23} {11} | L15: of:=ORG.LIBREOFFICE.REGEX([.L5];"_|\^";" ";"g") -> k {123} {011}
F16: of:=ORG.LIBREOFFICE.REGEX([.F6];"_|\^";" ";"g") -> k 1 1 | G16: of:=ORG.LIBREOFFICE.REGEX([.G6];"_|\^";" ";"g") -> k 2 0 | H16: of:=ORG.LIBREOFFICE.REGEX([.H6];"_|\^";" ";"g") -> k 3 0 | I16: of:=ORG.LIBREOFFICE.REGEX([.I6];"_|\^";" ";"g") -> k {12} {10} | J16: of:=ORG.LIBREOFFICE.REGEX([.J6];"_|\^";" ";"g") -> k {13} {10} | K16: of:=ORG.LIBREOFFICE.REGEX([.K6];"_|\^";" ";"g") -> k {23} {00} | L16: of:=ORG.LIBREOFFICE.REGEX([.L6];"_|\^";" ";"g") -> k {123} {100}
F17: of:=ORG.LIBREOFFICE.REGEX([.F7];"_|\^";" ";"g") -> k 1 1 | G17: of:=ORG.LIBREOFFICE.REGEX([.G7];"_|\^";" ";"g") -> k 2 0 | H17: of:=ORG.LIBREOFFICE.REGEX([.H7];"_|\^";" ";"g") -> k 3 1 | I17: of:=ORG.LIBREOFFICE.REGEX([.I7];"_|\^";" ";"g") -> k {12} {10} | J17: of:=ORG.LIBREOFFICE.REGEX([.J7];"_|\^";" ";"g") -> k {13} {11} | K17: of:=ORG.LIBREOFFICE.REGEX([.K7];"_|\^";" ";"g") -> k {23} {01} | L17: of:=ORG.LIBREOFFICE.REGEX([.L7];"_|\^";" ";"g") -> k {123} {101}
F18: of:=ORG.LIBREOFFICE.REGEX([.F8];"_|\^";" ";"g") -> k 1 1 | G18: of:=ORG.LIBREOFFICE.REGEX([.G8];"_|\^";" ";"g") -> k 2 1 | H18: of:=ORG.LIBREOFFICE.REGEX([.H8];"_|\^";" ";"g") -> k 3 0 | I18: of:=ORG.LIBREOFFICE.REGEX([.I8];"_|\^";" ";"g") -> k {12} {11} | J18: of:=ORG.LIBREOFFICE.REGEX([.J8];"_|\^";" ";"g") -> k {13} {10} | K18: of:=ORG.LIBREOFFICE.REGEX([.K8];"_|\^";" ";"g") -> k {23} {10} | L18: of:=ORG.LIBREOFFICE.REGEX([.L8];"_|\^";" ";"g") -> k {123} {110}
F19: of:=ORG.LIBREOFFICE.REGEX([.F9];"_|\^";" ";"g") -> k 1 1 | G19: of:=ORG.LIBREOFFICE.REGEX([.G9];"_|\^";" ";"g") -> k 2 1 | H19: of:=ORG.LIBREOFFICE.REGEX([.H9];"_|\^";" ";"g") -> k 3 1 | I19: of:=ORG.LIBREOFFICE.REGEX([.I9];"_|\^";" ";"g") -> k {12} {11} | J19: of:=ORG.LIBREOFFICE.REGEX([.J9];"_|\^";" ";"g") -> k {13} {11} | K19: of:=ORG.LIBREOFFICE.REGEX([.K9];"_|\^";" ";"g") -> k {23} {11} | L19: of:=ORG.LIBREOFFICE.REGEX([.L9];"_|\^";" ";"g") -> k {123} {111}
F22: 0 | G22: 0 | H22: 0 | I22: 0 | J22: 0 | M22: of:=[.M2] -> 1
F23: 0 | G23: 0 | H23: 0 | I23: 0 | J23: 0 | K23: 0 | L23: 0 | M23: of:=[.M3] -> 0
F24: 0 | G24: 0 | H24: 0 | I24: 0 | J24: 0 | K24: 0 | L24: 0 | M24: of:=[.M4] -> 0
F25: 0 | G25: 0 | H25: 0 | I25: 0 | J25: 0 | K25: 0 | L25: 0 | M25: of:=[.M5] -> 0
F26: 0 | G26: 0 | H26: 0 | I26: 0 | M26: of:=[.M6] -> 1
F27: 0 | G27: 0 | H27: 0 | I27: 0 | J27: 0 | K27: 0 | L27: 0 | M27: of:=[.M7] -> 0
F28: 0 | G28: 0 | H28: 0 | K28: 0 | M28: of:=[.M8] -> 1
F29: 0 | G29: 0 | H29: 0 | J29: 0 | K29: 0 | M29: of:=[.M9] -> 1
F32: of:=IF(OR(ISBLANK([.F22]);[.F22]);[.F2];"\cancel{"&[.F2]&"}") -> \cancel{k_1^0} | G32: of:=IF(OR(ISBLANK([.G22]);[.G22]);[.G2];"\cancel{"&[.G2]&"}") -> \cancel{k_2^0} | H32: of:=IF(OR(ISBLANK([.H22]);[.H22]);[.H2];"\cancel{"&[.H2]&"}") -> \cancel{k_3^0} | I32: of:=IF(OR(ISBLANK([.I22]);[.I22]);[.I2];"\cancel{"&[.I2]&"}") -> \cancel{k_{12}^{00}} | J32: of:=IF(OR(ISBLANK([.J22]);[.J22]);[.J2];"\cancel{"&[.J2]&"}") -> \cancel{k_{13}^{00}} | K32: of:=IF(OR(ISBLANK([.K22]);[.K22]);[.K2];"\cancel{"&[.K2]&"}") -> k_{23}^{00} | L32: of:=IF(OR(ISBLANK([.L22]);[.L22]);[.L2];"\cancel{"&[.L2]&"}") -> k_{123}^{000} | M32: of:=[.M2] -> 1 | O32: of:=COM.MICROSOFT.TEXTJOIN(" \lor "; 0; [.F32:.L32]) -> \cancel{k_1^0} \lor \cancel{k_2^0} \lor \cancel{k_3^0} \lor \cancel{k_{12}^{00}} \lor \cancel{k_{13}^{00}} \lor k_{23}^{00} \lor k_{123}^{000} | P32: of:=[.O32] & " = " & [.M2] -> \cancel{k_1^0} \lor \cancel{k_2^0} \lor \cancel{k_3^0} \lor \cancel{k_{12}^{00}} \lor \cancel{k_{13}^{00}} \lor k_{23}^{00} \lor k_{123}^{000} = 1 | Q32: of:="$$" & [.P32] & "$$" -> $$\cancel{k_1^0} \lor \cancel{k_2^0} \lor \cancel{k_3^0} \lor \cancel{k_{12}^{00}} \lor \cancel{k_{13}^{00}} \lor k_{23}^{00} \lor k_{123}^{000} = 1$$
F33: of:=IF(OR(ISBLANK([.F23]);[.F23]);[.F3];"\cancel{"&[.F3]&"}") -> \cancel{k_1^0} | G33: of:=IF(OR(ISBLANK([.G23]);[.G23]);[.G3];"\cancel{"&[.G3]&"}") -> \cancel{k_2^0} | H33: of:=IF(OR(ISBLANK([.H23]);[.H23]);[.H3];"\cancel{"&[.H3]&"}") -> \cancel{k_3^1} | I33: of:=IF(OR(ISBLANK([.I23]);[.I23]);[.I3];"\cancel{"&[.I3]&"}") -> \cancel{k_{12}^{00}} | J33: of:=IF(OR(ISBLANK([.J23]);[.J23]);[.J3];"\cancel{"&[.J3]&"}") -> \cancel{k_{13}^{01}} | K33: of:=IF(OR(ISBLANK([.K23]);[.K23]);[.K3];"\cancel{"&[.K3]&"}") -> \cancel{k_{23}^{01}} | L33: of:=IF(OR(ISBLANK([.L23]);[.L23]);[.L3];"\cancel{"&[.L3]&"}") -> \cancel{k_{123}^{001}} | M33: of:=[.M3] -> 0 | O33: of:=COM.MICROSOFT.TEXTJOIN(" \lor "; 0; [.F33:.L33]) -> \cancel{k_1^0} \lor \cancel{k_2^0} \lor \cancel{k_3^1} \lor \cancel{k_{12}^{00}} \lor \cancel{k_{13}^{01}} \lor \cancel{k_{23}^{01}} \lor \cancel{k_{123}^{001}} | P33: of:=[.O33] & " = " & [.M3] -> \cancel{k_1^0} \lor \cancel{k_2^0} \lor \cancel{k_3^1} \lor \cancel{k_{12}^{00}} \lor \cancel{k_{13}^{01}} \lor \cancel{k_{23}^{01}} \lor \cancel{k_{123}^{001}} = 0 | Q33: of:="$$" & [.P33] & "$$" -> $$\cancel{k_1^0} \lor \cancel{k_2^0} \lor \cancel{k_3^1} \lor \cancel{k_{12}^{00}} \lor \cancel{k_{13}^{01}} \lor \cancel{k_{23}^{01}} \lor \cancel{k_{123}^{001}} = 0$$
F34: of:=IF(OR(ISBLANK([.F24]);[.F24]);[.F4];"\cancel{"&[.F4]&"}") -> \cancel{k_1^0} | G34: of:=IF(OR(ISBLANK([.G24]);[.G24]);[.G4];"\cancel{"&[.G4]&"}") -> \cancel{k_2^1} | H34: of:=IF(OR(ISBLANK([.H24]);[.H24]);[.H4];"\cancel{"&[.H4]&"}") -> \cancel{k_3^0} | I34: of:=IF(OR(ISBLANK([.I24]);[.I24]);[.I4];"\cancel{"&[.I4]&"}") -> \cancel{k_{12}^{01}} | J34: of:=IF(OR(ISBLANK([.J24]);[.J24]);[.J4];"\cancel{"&[.J4]&"}") -> \cancel{k_{13}^{00}} | K34: of:=IF(OR(ISBLANK([.K24]);[.K24]);[.K4];"\cancel{"&[.K4]&"}") -> \cancel{k_{23}^{10}} | L34: of:=IF(OR(ISBLANK([.L24]);[.L24]);[.L4];"\cancel{"&[.L4]&"}") -> \cancel{k_{123}^{010}} | M34: of:=[.M4] -> 0 | O34: of:=COM.MICROSOFT.TEXTJOIN(" \lor "; 0; [.F34:.L34]) -> \cancel{k_1^0} \lor \cancel{k_2^1} \lor \cancel{k_3^0} \lor \cancel{k_{12}^{01}} \lor \cancel{k_{13}^{00}} \lor \cancel{k_{23}^{10}} \lor \cancel{k_{123}^{010}} | P34: of:=[.O34] & " = " & [.M4] -> \cancel{k_1^0} \lor \cancel{k_2^1} \lor \cancel{k_3^0} \lor \cancel{k_{12}^{01}} \lor \cancel{k_{13}^{00}} \lor \cancel{k_{23}^{10}} \lor \cancel{k_{123}^{010}} = 0 | Q34: of:="$$" & [.P34] & "$$" -> $$\cancel{k_1^0} \lor \cancel{k_2^1} \lor \cancel{k_3^0} \lor \cancel{k_{12}^{01}} \lor \cancel{k_{13}^{00}} \lor \cancel{k_{23}^{10}} \lor \cancel{k_{123}^{010}} = 0$$
F35: of:=IF(OR(ISBLANK([.F25]);[.F25]);[.F5];"\cancel{"&[.F5]&"}") -> \cancel{k_1^0} | G35: of:=IF(OR(ISBLANK([.G25]);[.G25]);[.G5];"\cancel{"&[.G5]&"}") -> \cancel{k_2^1} | H35: of:=IF(OR(ISBLANK([.H25]);[.H25]);[.H5];"\cancel{"&[.H5]&"}") -> \cancel{k_3^1} | I35: of:=IF(OR(ISBLANK([.I25]);[.I25]);[.I5];"\cancel{"&[.I5]&"}") -> \cancel{k_{12}^{01}} | J35: of:=IF(OR(ISBLANK([.J25]);[.J25]);[.J5];"\cancel{"&[.J5]&"}") -> \cancel{k_{13}^{01}} | K35: of:=IF(OR(ISBLANK([.K25]);[.K25]);[.K5];"\cancel{"&[.K5]&"}") -> \cancel{k_{23}^{11}} | L35: of:=IF(OR(ISBLANK([.L25]);[.L25]);[.L5];"\cancel{"&[.L5]&"}") -> \cancel{k_{123}^{011}} | M35: of:=[.M5] -> 0 | O35: of:=COM.MICROSOFT.TEXTJOIN(" \lor "; 0; [.F35:.L35]) -> \cancel{k_1^0} \lor \cancel{k_2^1} \lor \cancel{k_3^1} \lor \cancel{k_{12}^{01}} \lor \cancel{k_{13}^{01}} \lor \cancel{k_{23}^{11}} \lor \cancel{k_{123}^{011}} | P35: of:=[.O35] & " = " & [.M5] -> \cancel{k_1^0} \lor \cancel{k_2^1} \lor \cancel{k_3^1} \lor \cancel{k_{12}^{01}} \lor \cancel{k_{13}^{01}} \lor \cancel{k_{23}^{11}} \lor \cancel{k_{123}^{011}} = 0 | Q35: of:="$$" & [.P35] & "$$" -> $$\cancel{k_1^0} \lor \cancel{k_2^1} \lor \cancel{k_3^1} \lor \cancel{k_{12}^{01}} \lor \cancel{k_{13}^{01}} \lor \cancel{k_{23}^{11}} \lor \cancel{k_{123}^{011}} = 0$$
F36: of:=IF(OR(ISBLANK([.F26]);[.F26]);[.F6];"\cancel{"&[.F6]&"}") -> \cancel{k_1^1} | G36: of:=IF(OR(ISBLANK([.G26]);[.G26]);[.G6];"\cancel{"&[.G6]&"}") -> \cancel{k_2^0} | H36: of:=IF(OR(ISBLANK([.H26]);[.H26]);[.H6];"\cancel{"&[.H6]&"}") -> \cancel{k_3^0} | I36: of:=IF(OR(ISBLANK([.I26]);[.I26]);[.I6];"\cancel{"&[.I6]&"}") -> \cancel{k_{12}^{10}} | J36: of:=IF(OR(ISBLANK([.J26]);[.J26]);[.J6];"\cancel{"&[.J6]&"}") -> k_{13}^{10} | K36: of:=IF(OR(ISBLANK([.K26]);[.K26]);[.K6];"\cancel{"&[.K6]&"}") -> k_{23}^{00} | L36: of:=IF(OR(ISBLANK([.L26]);[.L26]);[.L6];"\cancel{"&[.L6]&"}") -> k_{123}^{100} | M36: of:=[.M6] -> 1 | O36: of:=COM.MICROSOFT.TEXTJOIN(" \lor "; 0; [.F36:.L36]) -> \cancel{k_1^1} \lor \cancel{k_2^0} \lor \cancel{k_3^0} \lor \cancel{k_{12}^{10}} \lor k_{13}^{10} \lor k_{23}^{00} \lor k_{123}^{100} | P36: of:=[.O36] & " = " & [.M6] -> \cancel{k_1^1} \lor \cancel{k_2^0} \lor \cancel{k_3^0} \lor \cancel{k_{12}^{10}} \lor k_{13}^{10} \lor k_{23}^{00} \lor k_{123}^{100} = 1 | Q36: of:="$$" & [.P36] & "$$" -> $$\cancel{k_1^1} \lor \cancel{k_2^0} \lor \cancel{k_3^0} \lor \cancel{k_{12}^{10}} \lor k_{13}^{10} \lor k_{23}^{00} \lor k_{123}^{100} = 1$$
F37: of:=IF(OR(ISBLANK([.F27]);[.F27]);[.F7];"\cancel{"&[.F7]&"}") -> \cancel{k_1^1} | G37: of:=IF(OR(ISBLANK([.G27]);[.G27]);[.G7];"\cancel{"&[.G7]&"}") -> \cancel{k_2^0} | H37: of:=IF(OR(ISBLANK([.H27]);[.H27]);[.H7];"\cancel{"&[.H7]&"}") -> \cancel{k_3^1} | I37: of:=IF(OR(ISBLANK([.I27]);[.I27]);[.I7];"\cancel{"&[.I7]&"}") -> \cancel{k_{12}^{10}} | J37: of:=IF(OR(ISBLANK([.J27]);[.J27]);[.J7];"\cancel{"&[.J7]&"}") -> \cancel{k_{13}^{11}} | K37: of:=IF(OR(ISBLANK([.K27]);[.K27]);[.K7];"\cancel{"&[.K7]&"}") -> \cancel{k_{23}^{01}} | L37: of:=IF(OR(ISBLANK([.L27]);[.L27]);[.L7];"\cancel{"&[.L7]&"}") -> \cancel{k_{123}^{101}} | M37: of:=[.M7] -> 0 | O37: of:=COM.MICROSOFT.TEXTJOIN(" \lor "; 0; [.F37:.L37]) -> \cancel{k_1^1} \lor \cancel{k_2^0} \lor \cancel{k_3^1} \lor \cancel{k_{12}^{10}} \lor \cancel{k_{13}^{11}} \lor \cancel{k_{23}^{01}} \lor \cancel{k_{123}^{101}} | P37: of:=[.O37] & " = " & [.M7] -> \cancel{k_1^1} \lor \cancel{k_2^0} \lor \cancel{k_3^1} \lor \cancel{k_{12}^{10}} \lor \cancel{k_{13}^{11}} \lor \cancel{k_{23}^{01}} \lor \cancel{k_{123}^{101}} = 0 | Q37: of:="$$" & [.P37] & "$$" -> $$\cancel{k_1^1} \lor \cancel{k_2^0} \lor \cancel{k_3^1} \lor \cancel{k_{12}^{10}} \lor \cancel{k_{13}^{11}} \lor \cancel{k_{23}^{01}} \lor \cancel{k_{123}^{101}} = 0$$
F38: of:=IF(OR(ISBLANK([.F28]);[.F28]);[.F8];"\cancel{"&[.F8]&"}") -> \cancel{k_1^1} | G38: of:=IF(OR(ISBLANK([.G28]);[.G28]);[.G8];"\cancel{"&[.G8]&"}") -> \cancel{k_2^1} | H38: of:=IF(OR(ISBLANK([.H28]);[.H28]);[.H8];"\cancel{"&[.H8]&"}") -> \cancel{k_3^0} | I38: of:=IF(OR(ISBLANK([.I28]);[.I28]);[.I8];"\cancel{"&[.I8]&"}") -> k_{12}^{11} | J38: of:=IF(OR(ISBLANK([.J28]);[.J28]);[.J8];"\cancel{"&[.J8]&"}") -> k_{13}^{10} | K38: of:=IF(OR(ISBLANK([.K28]);[.K28]);[.K8];"\cancel{"&[.K8]&"}") -> \cancel{k_{23}^{10}} | L38: of:=IF(OR(ISBLANK([.L28]);[.L28]);[.L8];"\cancel{"&[.L8]&"}") -> k_{123}^{110} | M38: of:=[.M8] -> 1 | O38: of:=COM.MICROSOFT.TEXTJOIN(" \lor "; 0; [.F38:.L38]) -> \cancel{k_1^1} \lor \cancel{k_2^1} \lor \cancel{k_3^0} \lor k_{12}^{11} \lor k_{13}^{10} \lor \cancel{k_{23}^{10}} \lor k_{123}^{110} | P38: of:=[.O38] & " = " & [.M8] -> \cancel{k_1^1} \lor \cancel{k_2^1} \lor \cancel{k_3^0} \lor k_{12}^{11} \lor k_{13}^{10} \lor \cancel{k_{23}^{10}} \lor k_{123}^{110} = 1 | Q38: of:="$$" & [.P38] & "$$" -> $$\cancel{k_1^1} \lor \cancel{k_2^1} \lor \cancel{k_3^0} \lor k_{12}^{11} \lor k_{13}^{10} \lor \cancel{k_{23}^{10}} \lor k_{123}^{110} = 1$$
F39: of:=IF(OR(ISBLANK([.F29]);[.F29]);[.F9];"\cancel{"&[.F9]&"}") -> \cancel{k_1^1} | G39: of:=IF(OR(ISBLANK([.G29]);[.G29]);[.G9];"\cancel{"&[.G9]&"}") -> \cancel{k_2^1} | H39: of:=IF(OR(ISBLANK([.H29]);[.H29]);[.H9];"\cancel{"&[.H9]&"}") -> \cancel{k_3^1} | I39: of:=IF(OR(ISBLANK([.I29]);[.I29]);[.I9];"\cancel{"&[.I9]&"}") -> k_{12}^{11} | J39: of:=IF(OR(ISBLANK([.J29]);[.J29]);[.J9];"\cancel{"&[.J9]&"}") -> \cancel{k_{13}^{11}} | K39: of:=IF(OR(ISBLANK([.K29]);[.K29]);[.K9];"\cancel{"&[.K9]&"}") -> \cancel{k_{23}^{11}} | L39: of:=IF(OR(ISBLANK([.L29]);[.L29]);[.L9];"\cancel{"&[.L9]&"}") -> k_{123}^{111} | M39: of:=[.M9] -> 1 | O39: of:=COM.MICROSOFT.TEXTJOIN(" \lor "; 0; [.F39:.L39]) -> \cancel{k_1^1} \lor \cancel{k_2^1} \lor \cancel{k_3^1} \lor k_{12}^{11} \lor \cancel{k_{13}^{11}} \lor \cancel{k_{23}^{11}} \lor k_{123}^{111} | P39: of:=[.O39] & " = " & [.M9] -> \cancel{k_1^1} \lor \cancel{k_2^1} \lor \cancel{k_3^1} \lor k_{12}^{11} \lor \cancel{k_{13}^{11}} \lor \cancel{k_{23}^{11}} \lor k_{123}^{111} = 1 | Q39: of:="$$" & [.P39] & "$$" -> $$\cancel{k_1^1} \lor \cancel{k_2^1} \lor \cancel{k_3^1} \lor k_{12}^{11} \lor \cancel{k_{13}^{11}} \lor \cancel{k_{23}^{11}} \lor k_{123}^{111} = 1$$
F42: of:=IF(LEFT([.F32];8)="\cancel{"; ""; [.F32]) ->  | G42: of:=IF(LEFT([.G32];8)="\cancel{"; ""; [.G32]) ->  | H42: of:=IF(LEFT([.H32];8)="\cancel{"; ""; [.H32]) ->  | I42: of:=IF(LEFT([.I32];8)="\cancel{"; ""; [.I32]) ->  | J42: of:=IF(LEFT([.J32];8)="\cancel{"; ""; [.J32]) ->  | K42: of:=IF(LEFT([.K32];8)="\cancel{"; ""; [.K32]) -> k_{23}^{00} | L42: of:=IF(LEFT([.L32];8)="\cancel{"; ""; [.L32]) -> k_{123}^{000} | M42: of:=IF([.M2];[.M2];"") -> 1 | O42: of:=COM.MICROSOFT.TEXTJOIN(" \lor "; 1; [.F42:.L42]) -> k_{23}^{00} \lor k_{123}^{000} | P42: of:=IF([.M42]=1; [.O42] & " = " & [.M42]; "") -> k_{23}^{00} \lor k_{123}^{000} = 1 | Q42: of:="$$" & [.P42] & "$$" -> $$k_{23}^{00} \lor k_{123}^{000} = 1$$ | R42: of:=IF([.Q42]<>"$$$$";[.Q42];"") -> $$k_{23}^{00} \lor k_{123}^{000} = 1$$
F43: of:=IF(LEFT([.F33];8)="\cancel{"; ""; [.F33]) ->  | G43: of:=IF(LEFT([.G33];8)="\cancel{"; ""; [.G33]) ->  | H43: of:=IF(LEFT([.H33];8)="\cancel{"; ""; [.H33]) ->  | I43: of:=IF(LEFT([.I33];8)="\cancel{"; ""; [.I33]) ->  | J43: of:=IF(LEFT([.J33];8)="\cancel{"; ""; [.J33]) ->  | K43: of:=IF(LEFT([.K33];8)="\cancel{"; ""; [.K33]) ->  | L43: of:=IF(LEFT([.L33];8)="\cancel{"; ""; [.L33]) ->  | M43: of:=IF([.M3];[.M3];"") ->  | O43: of:=COM.MICROSOFT.TEXTJOIN(" \lor "; 1; [.F43:.L43]) ->  | P43: of:=IF([.M43]=1; [.O43] & " = " & [.M43]; "") ->  | Q43: of:="$$" & [.P43] & "$$" -> $$$$ | R43: of:=IF([.Q43]<>"$$$$";[.Q43];"") -> 
F44: of:=IF(LEFT([.F34];8)="\cancel{"; ""; [.F34]) ->  | G44: of:=IF(LEFT([.G34];8)="\cancel{"; ""; [.G34]) ->  | H44: of:=IF(LEFT([.H34];8)="\cancel{"; ""; [.H34]) ->  | I44: of:=IF(LEFT([.I34];8)="\cancel{"; ""; [.I34]) ->  | J44: of:=IF(LEFT([.J34];8)="\cancel{"; ""; [.J34]) ->  | K44: of:=IF(LEFT([.K34];8)="\cancel{"; ""; [.K34]) ->  | L44: of:=IF(LEFT([.L34];8)="\cancel{"; ""; [.L34]) ->  | M44: of:=IF([.M4];[.M4];"") ->  | O44: of:=COM.MICROSOFT.TEXTJOIN(" \lor "; 1; [.F44:.L44]) ->  | P44: of:=IF([.M44]=1; [.O44] & " = " & [.M44]; "") ->  | Q44: of:="$$" & [.P44] & "$$" -> $$$$ | R44: of:=IF([.Q44]<>"$$$$";[.Q44];"") -> 
F45: of:=IF(LEFT([.F35];8)="\cancel{"; ""; [.F35]) ->  | G45: of:=IF(LEFT([.G35];8)="\cancel{"; ""; [.G35]) ->  | H45: of:=IF(LEFT([.H35];8)="\cancel{"; ""; [.H35]) ->  | I45: of:=IF(LEFT([.I35];8)="\cancel{"; ""; [.I35]) ->  | J45: of:=IF(LEFT([.J35];8)="\cancel{"; ""; [.J35]) ->  | K45: of:=IF(LEFT([.K35];8)="\cancel{"; ""; [.K35]) ->  | L45: of:=IF(LEFT([.L35];8)="\cancel{"; ""; [.L35]) ->  | M45: of:=IF([.M5];[.M5];"") ->  | O45: of:=COM.MICROSOFT.TEXTJOIN(" \lor "; 1; [.F45:.L45]) ->  | P45: of:=IF([.M45]=1; [.O45] & " = " & [.M45]; "") ->  | Q45: of:="$$" & [.P45] & "$$" -> $$$$ | R45: of:=IF([.Q45]<>"$$$$";[.Q45];"") -> 
F46: of:=IF(LEFT([.F36];8)="\cancel{"; ""; [.F36]) ->  | G46: of:=IF(LEFT([.G36];8)="\cancel{"; ""; [.G36]) ->  | H46: of:=IF(LEFT([.H36];8)="\cancel{"; ""; [.H36]) ->  | I46: of:=IF(LEFT([.I36];8)="\cancel{"; ""; [.I36]) ->  | J46: of:=IF(LEFT([.J36];8)="\cancel{"; ""; [.J36]) -> k_{13}^{10} | K46: of:=IF(LEFT([.K36];8)="\cancel{"; ""; [.K36]) -> k_{23}^{00} | L46: of:=IF(LEFT([.L36];8)="\cancel{"; ""; [.L36]) -> k_{123}^{100} | M46: of:=IF([.M6];[.M6];"") -> 1 | O46: of:=COM.MICROSOFT.TEXTJOIN(" \lor "; 1; [.F46:.L46]) -> k_{13}^{10} \lor k_{23}^{00} \lor k_{123}^{100} | P46: of:=IF([.M46]=1; [.O46] & " = " & [.M46]; "") -> k_{13}^{10} \lor k_{23}^{00} \lor k_{123}^{100} = 1 | Q46: of:="$$" & [.P46] & "$$" -> $$k_{13}^{10} \lor k_{23}^{00} \lor k_{123}^{100} = 1$$ | R46: of:=IF([.Q46]<>"$$$$";[.Q46];"") -> $$k_{13}^{10} \lor k_{23}^{00} \lor k_{123}^{100} = 1$$
F47: of:=IF(LEFT([.F37];8)="\cancel{"; ""; [.F37]) ->  | G47: of:=IF(LEFT([.G37];8)="\cancel{"; ""; [.G37]) ->  | H47: of:=IF(LEFT([.H37];8)="\cancel{"; ""; [.H37]) ->  | I47: of:=IF(LEFT([.I37];8)="\cancel{"; ""; [.I37]) ->  | J47: of:=IF(LEFT([.J37];8)="\cancel{"; ""; [.J37]) ->  | K47: of:=IF(LEFT([.K37];8)="\cancel{"; ""; [.K37]) ->  | L47: of:=IF(LEFT([.L37];8)="\cancel{"; ""; [.L37]) ->  | M47: of:=IF([.M7];[.M7];"") ->  | O47: of:=COM.MICROSOFT.TEXTJOIN(" \lor "; 1; [.F47:.L47]) ->  | P47: of:=IF([.M47]=1; [.O47] & " = " & [.M47]; "") ->  | Q47: of:="$$" & [.P47] & "$$" -> $$$$ | R47: of:=IF([.Q47]<>"$$$$";[.Q47];"") -> 
F48: of:=IF(LEFT([.F38];8)="\cancel{"; ""; [.F38]) ->  | G48: of:=IF(LEFT([.G38];8)="\cancel{"; ""; [.G38]) ->  | H48: of:=IF(LEFT([.H38];8)="\cancel{"; ""; [.H38]) ->  | I48: of:=IF(LEFT([.I38];8)="\cancel{"; ""; [.I38]) -> k_{12}^{11} | J48: of:=IF(LEFT([.J38];8)="\cancel{"; ""; [.J38]) -> k_{13}^{10} | K48: of:=IF(LEFT([.K38];8)="\cancel{"; ""; [.K38]) ->  | L48: of:=IF(LEFT([.L38];8)="\cancel{"; ""; [.L38]) -> k_{123}^{110} | M48: of:=IF([.M8];[.M8];"") -> 1 | O48: of:=COM.MICROSOFT.TEXTJOIN(" \lor "; 1; [.F48:.L48]) -> k_{12}^{11} \lor k_{13}^{10} \lor k_{123}^{110} | P48: of:=IF([.M48]=1; [.O48] & " = " & [.M48]; "") -> k_{12}^{11} \lor k_{13}^{10} \lor k_{123}^{110} = 1 | Q48: of:="$$" & [.P48] & "$$" -> $$k_{12}^{11} \lor k_{13}^{10} \lor k_{123}^{110} = 1$$ | R48: of:=IF([.Q48]<>"$$$$";[.Q48];"") -> $$k_{12}^{11} \lor k_{13}^{10} \lor k_{123}^{110} = 1$$
F49: of:=IF(LEFT([.F39];8)="\cancel{"; ""; [.F39]) ->  | G49: of:=IF(LEFT([.G39];8)="\cancel{"; ""; [.G39]) ->  | H49: of:=IF(LEFT([.H39];8)="\cancel{"; ""; [.H39]) ->  | I49: of:=IF(LEFT([.I39];8)="\cancel{"; ""; [.I39]) -> k_{12}^{11} | J49: of:=IF(LEFT([.J39];8)="\cancel{"; ""; [.J39]) ->  | K49: of:=IF(LEFT([.K39];8)="\cancel{"; ""; [.K39]) ->  | L49: of:=IF(LEFT([.L39];8)="\cancel{"; ""; [.L39]) -> k_{123}^{111} | M49: of:=IF([.M9];[.M9];"") -> 1 | O49: of:=COM.MICROSOFT.TEXTJOIN(" \lor "; 1; [.F49:.L49]) -> k_{12}^{11} \lor k_{123}^{111} | P49: of:=IF([.M49]=1; [.O49] & " = " & [.M49]; "") -> k_{12}^{11} \lor k_{123}^{111} = 1 | Q49: of:="$$" & [.P49] & "$$" -> $$k_{12}^{11} \lor k_{123}^{111} = 1$$ | R49: of:=IF([.Q49]<>"$$$$";[.Q49];"") -> $$k_{12}^{11} \lor k_{123}^{111} = 1$$