Sheet: 2a manual
A1: x | B1: y | C1: z | D1: t
A2: 0 | B2: 0 | C2: 0 | D2: 0 | F2: of:=AND(NOT([.A2]); NOT([.B2])) -> true | G2: of:=AND(NOT([.A2]); [.B2]; NOT([.C2])) -> false | H2: of:=AND([.A2];NOT([.B2]);NOT([.C2]);[.D2]) -> false | I2: of:=AND([.A2:.D2]) -> false | K2: of:=OR([.F2:.I2]) -> true | L2: 0 | M2: of:=IF([.K2];[.L2];"") -> 0
A3: 0 | B3: 0 | C3: 0 | D3: 1 | F3: of:=AND(NOT([.A3]); NOT([.B3])) -> true | G3: of:=AND(NOT([.A3]); [.B3]; NOT([.C3])) -> false | H3: of:=AND([.A3];NOT([.B3]);NOT([.C3]);[.D3]) -> false | I3: of:=AND([.A3:.D3]) -> false | K3: of:=OR([.F3:.I3]) -> true | L3: 1 | M3: of:=IF([.K3];[.L3];"") -> 1
A4: 0 | B4: 0 | C4: 1 | D4: 0 | F4: of:=AND(NOT([.A4]); NOT([.B4])) -> true | G4: of:=AND(NOT([.A4]); [.B4]; NOT([.C4])) -> false | H4: of:=AND([.A4];NOT([.B4]);NOT([.C4]);[.D4]) -> false | I4: of:=AND([.A4:.D4]) -> false | K4: of:=OR([.F4:.I4]) -> true | L4: 2 | M4: of:=IF([.K4];[.L4];"") -> 2
A5: 0 | B5: 0 | C5: 1 | D5: 1 | F5: of:=AND(NOT([.A5]); NOT([.B5])) -> true | G5: of:=AND(NOT([.A5]); [.B5]; NOT([.C5])) -> false | H5: of:=AND([.A5];NOT([.B5]);NOT([.C5]);[.D5]) -> false | I5: of:=AND([.A5:.D5]) -> false | K5: of:=OR([.F5:.I5]) -> true | L5: 3 | M5: of:=IF([.K5];[.L5];"") -> 3
A6: 0 | B6: 1 | C6: 0 | D6: 0 | F6: of:=AND(NOT([.A6]); NOT([.B6])) -> false | G6: of:=AND(NOT([.A6]); [.B6]; NOT([.C6])) -> true | H6: of:=AND([.A6];NOT([.B6]);NOT([.C6]);[.D6]) -> false | I6: of:=AND([.A6:.D6]) -> false | K6: of:=OR([.F6:.I6]) -> true | L6: 4 | M6: of:=IF([.K6];[.L6];"") -> 4
A7: 0 | B7: 1 | C7: 0 | D7: 1 | F7: of:=AND(NOT([.A7]); NOT([.B7])) -> false | G7: of:=AND(NOT([.A7]); [.B7]; NOT([.C7])) -> true | H7: of:=AND([.A7];NOT([.B7]);NOT([.C7]);[.D7]) -> false | I7: of:=AND([.A7:.D7]) -> false | K7: of:=OR([.F7:.I7]) -> true | L7: 5 | M7: of:=IF([.K7];[.L7];"") -> 5
A8: 0 | B8: 1 | C8: 1 | D8: 0 | F8: of:=AND(NOT([.A8]); NOT([.B8])) -> false | G8: of:=AND(NOT([.A8]); [.B8]; NOT([.C8])) -> false | H8: of:=AND([.A8];NOT([.B8]);NOT([.C8]);[.D8]) -> false | I8: of:=AND([.A8:.D8]) -> false | K8: of:=OR([.F8:.I8]) -> false | L8: 6 | M8: of:=IF([.K8];[.L8];"") -> 
A9: 0 | B9: 1 | C9: 1 | D9: 1 | F9: of:=AND(NOT([.A9]); NOT([.B9])) -> false | G9: of:=AND(NOT([.A9]); [.B9]; NOT([.C9])) -> false | H9: of:=AND([.A9];NOT([.B9]);NOT([.C9]);[.D9]) -> false | I9: of:=AND([.A9:.D9]) -> false | K9: of:=OR([.F9:.I9]) -> false | L9: 7 | M9: of:=IF([.K9];[.L9];"") -> 
A10: 1 | B10: 0 | C10: 0 | D10: 0 | F10: of:=AND(NOT([.A10]); NOT([.B10])) -> false | G10: of:=AND(NOT([.A10]); [.B10]; NOT([.C10])) -> false | H10: of:=AND([.A10];NOT([.B10]);NOT([.C10]);[.D10]) -> false | I10: of:=AND([.A10:.D10]) -> false | K10: of:=OR([.F10:.I10]) -> false | L10: 8 | M10: of:=IF([.K10];[.L10];"") -> 
A11: 1 | B11: 0 | C11: 0 | D11: 1 | F11: of:=AND(NOT([.A11]); NOT([.B11])) -> false | G11: of:=AND(NOT([.A11]); [.B11]; NOT([.C11])) -> false | H11: of:=AND([.A11];NOT([.B11]);NOT([.C11]);[.D11]) -> true | I11: of:=AND([.A11:.D11]) -> false | K11: of:=OR([.F11:.I11]) -> true | L11: 9 | M11: of:=IF([.K11];[.L11];"") -> 9
A12: 1 | B12: 0 | C12: 1 | D12: 0 | F12: of:=AND(NOT([.A12]); NOT([.B12])) -> false | G12: of:=AND(NOT([.A12]); [.B12]; NOT([.C12])) -> false | H12: of:=AND([.A12];NOT([.B12]);NOT([.C12]);[.D12]) -> false | I12: of:=AND([.A12:.D12]) -> false | K12: of:=OR([.F12:.I12]) -> false | L12: 10 | M12: of:=IF([.K12];[.L12];"") -> 
A13: 1 | B13: 0 | C13: 1 | D13: 1 | F13: of:=AND(NOT([.A13]); NOT([.B13])) -> false | G13: of:=AND(NOT([.A13]); [.B13]; NOT([.C13])) -> false | H13: of:=AND([.A13];NOT([.B13]);NOT([.C13]);[.D13]) -> false | I13: of:=AND([.A13:.D13]) -> false | K13: of:=OR([.F13:.I13]) -> false | L13: 11 | M13: of:=IF([.K13];[.L13];"") -> 
A14: 1 | B14: 1 | C14: 0 | D14: 0 | F14: of:=AND(NOT([.A14]); NOT([.B14])) -> false | G14: of:=AND(NOT([.A14]); [.B14]; NOT([.C14])) -> false | H14: of:=AND([.A14];NOT([.B14]);NOT([.C14]);[.D14]) -> false | I14: of:=AND([.A14:.D14]) -> false | K14: of:=OR([.F14:.I14]) -> false | L14: 12 | M14: of:=IF([.K14];[.L14];"") -> 
A15: 1 | B15: 1 | C15: 0 | D15: 1 | F15: of:=AND(NOT([.A15]); NOT([.B15])) -> false | G15: of:=AND(NOT([.A15]); [.B15]; NOT([.C15])) -> false | H15: of:=AND([.A15];NOT([.B15]);NOT([.C15]);[.D15]) -> false | I15: of:=AND([.A15:.D15]) -> false | K15: of:=OR([.F15:.I15]) -> false | L15: 13 | M15: of:=IF([.K15];[.L15];"") -> 
A16: 1 | B16: 1 | C16: 1 | D16: 0 | F16: of:=AND(NOT([.A16]); NOT([.B16])) -> false | G16: of:=AND(NOT([.A16]); [.B16]; NOT([.C16])) -> false | H16: of:=AND([.A16];NOT([.B16]);NOT([.C16]);[.D16]) -> false | I16: of:=AND([.A16:.D16]) -> false | K16: of:=OR([.F16:.I16]) -> false | L16: 14 | M16: of:=IF([.K16];[.L16];"") -> 
A17: 1 | B17: 1 | C17: 1 | D17: 1 | F17: of:=AND(NOT([.A17]); NOT([.B17])) -> false | G17: of:=AND(NOT([.A17]); [.B17]; NOT([.C17])) -> false | H17: of:=AND([.A17];NOT([.B17]);NOT([.C17]);[.D17]) -> false | I17: of:=AND([.A17:.D17]) -> true | K17: of:=OR([.F17:.I17]) -> true | L17: 15 | M17: of:=IF([.K17];[.L17];"") -> 15

Sheet: 2a karnaugh
A1: x | B1: y | C1: z | D1: t
A2: 0 | B2: 0 | C2: 0 | D2: 0 | F2: of:=AND(NOT([.A2]); NOT([.B2])) -> true | G2: of:=AND(NOT([.A2]); [.B2]; NOT([.C2])) -> false | H2: of:=AND(NOT([.B2]);NOT([.C2]);[.D2]) -> false | I2: of:=AND([.A2:.D2]) -> false | K2: of:=OR([.F2:.I2]) -> true | L2: 0 | M2: of:=IF([.K2];[.L2];"") -> 0
A3: 0 | B3: 0 | C3: 0 | D3: 1 | F3: of:=AND(NOT([.A3]); NOT([.B3])) -> true | G3: of:=AND(NOT([.A3]); [.B3]; NOT([.C3])) -> false | H3: of:=AND(NOT([.B3]);NOT([.C3]);[.D3]) -> true | I3: of:=AND([.A3:.D3]) -> false | K3: of:=OR([.F3:.I3]) -> true | L3: 1 | M3: of:=IF([.K3];[.L3];"") -> 1
A4: 0 | B4: 0 | C4: 1 | D4: 0 | F4: of:=AND(NOT([.A4]); NOT([.B4])) -> true | G4: of:=AND(NOT([.A4]); [.B4]; NOT([.C4])) -> false | H4: of:=AND(NOT([.B4]);NOT([.C4]);[.D4]) -> false | I4: of:=AND([.A4:.D4]) -> false | K4: of:=OR([.F4:.I4]) -> true | L4: 2 | M4: of:=IF([.K4];[.L4];"") -> 2
A5: 0 | B5: 0 | C5: 1 | D5: 1 | F5: of:=AND(NOT([.A5]); NOT([.B5])) -> true | G5: of:=AND(NOT([.A5]); [.B5]; NOT([.C5])) -> false | H5: of:=AND(NOT([.B5]);NOT([.C5]);[.D5]) -> false | I5: of:=AND([.A5:.D5]) -> false | K5: of:=OR([.F5:.I5]) -> true | L5: 3 | M5: of:=IF([.K5];[.L5];"") -> 3
A6: 0 | B6: 1 | C6: 0 | D6: 0 | F6: of:=AND(NOT([.A6]); NOT([.B6])) -> false | G6: of:=AND(NOT([.A6]); [.B6]; NOT([.C6])) -> true | H6: of:=AND(NOT([.B6]);NOT([.C6]);[.D6]) -> false | I6: of:=AND([.A6:.D6]) -> false | K6: of:=OR([.F6:.I6]) -> true | L6: 4 | M6: of:=IF([.K6];[.L6];"") -> 4
A7: 0 | B7: 1 | C7: 0 | D7: 1 | F7: of:=AND(NOT([.A7]); NOT([.B7])) -> false | G7: of:=AND(NOT([.A7]); [.B7]; NOT([.C7])) -> true | H7: of:=AND(NOT([.B7]);NOT([.C7]);[.D7]) -> false | I7: of:=AND([.A7:.D7]) -> false | K7: of:=OR([.F7:.I7]) -> true | L7: 5 | M7: of:=IF([.K7];[.L7];"") -> 5
A8: 0 | B8: 1 | C8: 1 | D8: 0 | F8: of:=AND(NOT([.A8]); NOT([.B8])) -> false | G8: of:=AND(NOT([.A8]); [.B8]; NOT([.C8])) -> false | H8: of:=AND(NOT([.B8]);NOT([.C8]);[.D8]) -> false | I8: of:=AND([.A8:.D8]) -> false | K8: of:=OR([.F8:.I8]) -> false | L8: 6 | M8: of:=IF([.K8];[.L8];"") -> 
A9: 0 | B9: 1 | C9: 1 | D9: 1 | F9: of:=AND(NOT([.A9]); NOT([.B9])) -> false | G9: of:=AND(NOT([.A9]); [.B9]; NOT([.C9])) -> false | H9: of:=AND(NOT([.B9]);NOT([.C9]);[.D9]) -> false | I9: of:=AND([.A9:.D9]) -> false | K9: of:=OR([.F9:.I9]) -> false | L9: 7 | M9: of:=IF([.K9];[.L9];"") -> 
A10: 1 | B10: 0 | C10: 0 | D10: 0 | F10: of:=AND(NOT([.A10]); NOT([.B10])) -> false | G10: of:=AND(NOT([.A10]); [.B10]; NOT([.C10])) -> false | H10: of:=AND(NOT([.B10]);NOT([.C10]);[.D10]) -> false | I10: of:=AND([.A10:.D10]) -> false | K10: of:=OR([.F10:.I10]) -> false | L10: 8 | M10: of:=IF([.K10];[.L10];"") -> 
A11: 1 | B11: 0 | C11: 0 | D11: 1 | F11: of:=AND(NOT([.A11]); NOT([.B11])) -> false | G11: of:=AND(NOT([.A11]); [.B11]; NOT([.C11])) -> false | H11: of:=AND(NOT([.B11]);NOT([.C11]);[.D11]) -> true | I11: of:=AND([.A11:.D11]) -> false | K11: of:=OR([.F11:.I11]) -> true | L11: 9 | M11: of:=IF([.K11];[.L11];"") -> 9
A12: 1 | B12: 0 | C12: 1 | D12: 0 | F12: of:=AND(NOT([.A12]); NOT([.B12])) -> false | G12: of:=AND(NOT([.A12]); [.B12]; NOT([.C12])) -> false | H12: of:=AND(NOT([.B12]);NOT([.C12]);[.D12]) -> false | I12: of:=AND([.A12:.D12]) -> false | K12: of:=OR([.F12:.I12]) -> false | L12: 10 | M12: of:=IF([.K12];[.L12];"") -> 
A13: 1 | B13: 0 | C13: 1 | D13: 1 | F13: of:=AND(NOT([.A13]); NOT([.B13])) -> false | G13: of:=AND(NOT([.A13]); [.B13]; NOT([.C13])) -> false | H13: of:=AND(NOT([.B13]);NOT([.C13]);[.D13]) -> false | I13: of:=AND([.A13:.D13]) -> false | K13: of:=OR([.F13:.I13]) -> false | L13: 11 | M13: of:=IF([.K13];[.L13];"") -> 
A14: 1 | B14: 1 | C14: 0 | D14: 0 | F14: of:=AND(NOT([.A14]); NOT([.B14])) -> false | G14: of:=AND(NOT([.A14]); [.B14]; NOT([.C14])) -> false | H14: of:=AND(NOT([.B14]);NOT([.C14]);[.D14]) -> false | I14: of:=AND([.A14:.D14]) -> false | K14: of:=OR([.F14:.I14]) -> false | L14: 12 | M14: of:=IF([.K14];[.L14];"") -> 
A15: 1 | B15: 1 | C15: 0 | D15: 1 | F15: of:=AND(NOT([.A15]); NOT([.B15])) -> false | G15: of:=AND(NOT([.A15]); [.B15]; NOT([.C15])) -> false | H15: of:=AND(NOT([.B15]);NOT([.C15]);[.D15]) -> false | I15: of:=AND([.A15:.D15]) -> false | K15: of:=OR([.F15:.I15]) -> false | L15: 13 | M15: of:=IF([.K15];[.L15];"") -> 
A16: 1 | B16: 1 | C16: 1 | D16: 0 | F16: of:=AND(NOT([.A16]); NOT([.B16])) -> false | G16: of:=AND(NOT([.A16]); [.B16]; NOT([.C16])) -> false | H16: of:=AND(NOT([.B16]);NOT([.C16]);[.D16]) -> false | I16: of:=AND([.A16:.D16]) -> false | K16: of:=OR([.F16:.I16]) -> false | L16: 14 | M16: of:=IF([.K16];[.L16];"") -> 
A17: 1 | B17: 1 | C17: 1 | D17: 1 | F17: of:=AND(NOT([.A17]); NOT([.B17])) -> false | G17: of:=AND(NOT([.A17]); [.B17]; NOT([.C17])) -> false | H17: of:=AND(NOT([.B17]);NOT([.C17]);[.D17]) -> false | I17: of:=AND([.A17:.D17]) -> true | K17: of:=OR([.F17:.I17]) -> true | L17: 15 | M17: of:=IF([.K17];[.L17];"") -> 15

Sheet: 2b
A1: x | B1: y | C1: z | D1: t
A2: 0 | B2: 0 | C2: 0 | D2: 0 | F2: of:=AND(NOT([.A2]); ([.B2])) -> false | G2: of:=AND([.A2]; NOT([.C2]); NOT([.D2])) -> false | H2: of:=AND([.A2];NOT([.B2]);[.C2];[.D2]) -> false | I2: 0 | K2: of:=OR([.F2:.I2]) -> false | L2: 0 | M2: of:=IF([.K2];[.L2];"") -> 
A3: 0 | B3: 0 | C3: 0 | D3: 1 | F3: of:=AND(NOT([.A3]); ([.B3])) -> false | G3: of:=AND([.A3]; NOT([.C3]); NOT([.D3])) -> false | H3: of:=AND([.A3];NOT([.B3]);[.C3];[.D3]) -> false | I3: 0 | K3: of:=OR([.F3:.I3]) -> false | L3: 1 | M3: of:=IF([.K3];[.L3];"") -> 
A4: 0 | B4: 0 | C4: 1 | D4: 0 | F4: of:=AND(NOT([.A4]); ([.B4])) -> false | G4: of:=AND([.A4]; NOT([.C4]); NOT([.D4])) -> false | H4: of:=AND([.A4];NOT([.B4]);[.C4];[.D4]) -> false | I4: 0 | K4: of:=OR([.F4:.I4]) -> false | L4: 2 | M4: of:=IF([.K4];[.L4];"") -> 
A5: 0 | B5: 0 | C5: 1 | D5: 1 | F5: of:=AND(NOT([.A5]); ([.B5])) -> false | G5: of:=AND([.A5]; NOT([.C5]); NOT([.D5])) -> false | H5: of:=AND([.A5];NOT([.B5]);[.C5];[.D5]) -> false | I5: 0 | K5: of:=OR([.F5:.I5]) -> false | L5: 3 | M5: of:=IF([.K5];[.L5];"") -> 
A6: 0 | B6: 1 | C6: 0 | D6: 0 | F6: of:=AND(NOT([.A6]); ([.B6])) -> true | G6: of:=AND([.A6]; NOT([.C6]); NOT([.D6])) -> false | H6: of:=AND([.A6];NOT([.B6]);[.C6];[.D6]) -> false | I6: 0 | K6: of:=OR([.F6:.I6]) -> true | L6: 4 | M6: of:=IF([.K6];[.L6];"") -> 4
A7: 0 | B7: 1 | C7: 0 | D7: 1 | F7: of:=AND(NOT([.A7]); ([.B7])) -> true | G7: of:=AND([.A7]; NOT([.C7]); NOT([.D7])) -> false | H7: of:=AND([.A7];NOT([.B7]);[.C7];[.D7]) -> false | I7: 0 | K7: of:=OR([.F7:.I7]) -> true | L7: 5 | M7: of:=IF([.K7];[.L7];"") -> 5
A8: 0 | B8: 1 | C8: 1 | D8: 0 | F8: of:=AND(NOT([.A8]); ([.B8])) -> true | G8: of:=AND([.A8]; NOT([.C8]); NOT([.D8])) -> false | H8: of:=AND([.A8];NOT([.B8]);[.C8];[.D8]) -> false | I8: 0 | K8: of:=OR([.F8:.I8]) -> true | L8: 6 | M8: of:=IF([.K8];[.L8];"") -> 6
A9: 0 | B9: 1 | C9: 1 | D9: 1 | F9: of:=AND(NOT([.A9]); ([.B9])) -> true | G9: of:=AND([.A9]; NOT([.C9]); NOT([.D9])) -> false | H9: of:=AND([.A9];NOT([.B9]);[.C9];[.D9]) -> false | I9: 0 | K9: of:=OR([.F9:.I9]) -> true | L9: 7 | M9: of:=IF([.K9];[.L9];"") -> 7
A10: 1 | B10: 0 | C10: 0 | D10: 0 | F10: of:=AND(NOT([.A10]); ([.B10])) -> false | G10: of:=AND([.A10]; NOT([.C10]); NOT([.D10])) -> true | H10: of:=AND([.A10];NOT([.B10]);[.C10];[.D10]) -> false | I10: 0 | K10: of:=OR([.F10:.I10]) -> true | L10: 8 | M10: of:=IF([.K10];[.L10];"") -> 8
A11: 1 | B11: 0 | C11: 0 | D11: 1 | F11: of:=AND(NOT([.A11]); ([.B11])) -> false | G11: of:=AND([.A11]; NOT([.C11]); NOT([.D11])) -> false | H11: of:=AND([.A11];NOT([.B11]);[.C11];[.D11]) -> false | I11: 0 | K11: of:=OR([.F11:.I11]) -> false | L11: 9 | M11: of:=IF([.K11];[.L11];"") -> 
A12: 1 | B12: 0 | C12: 1 | D12: 0 | F12: of:=AND(NOT([.A12]); ([.B12])) -> false | G12: of:=AND([.A12]; NOT([.C12]); NOT([.D12])) -> false | H12: of:=AND([.A12];NOT([.B12]);[.C12];[.D12]) -> false | I12: 0 | K12: of:=OR([.F12:.I12]) -> false | L12: 10 | M12: of:=IF([.K12];[.L12];"") -> 
A13: 1 | B13: 0 | C13: 1 | D13: 1 | F13: of:=AND(NOT([.A13]); ([.B13])) -> false | G13: of:=AND([.A13]; NOT([.C13]); NOT([.D13])) -> false | H13: of:=AND([.A13];NOT([.B13]);[.C13];[.D13]) -> true | I13: 0 | K13: of:=OR([.F13:.I13]) -> true | L13: 11 | M13: of:=IF([.K13];[.L13];"") -> 11
A14: 1 | B14: 1 | C14: 0 | D14: 0 | F14: of:=AND(NOT([.A14]); ([.B14])) -> false | G14: of:=AND([.A14]; NOT([.C14]); NOT([.D14])) -> true | H14: of:=AND([.A14];NOT([.B14]);[.C14];[.D14]) -> false | I14: 0 | K14: of:=OR([.F14:.I14]) -> true | L14: 12 | M14: of:=IF([.K14];[.L14];"") -> 12
A15: 1 | B15: 1 | C15: 0 | D15: 1 | F15: of:=AND(NOT([.A15]); ([.B15])) -> false | G15: of:=AND([.A15]; NOT([.C15]); NOT([.D15])) -> false | H15: of:=AND([.A15];NOT([.B15]);[.C15];[.D15]) -> false | I15: 0 | K15: of:=OR([.F15:.I15]) -> false | L15: 13 | M15: of:=IF([.K15];[.L15];"") -> 
A16: 1 | B16: 1 | C16: 1 | D16: 0 | F16: of:=AND(NOT([.A16]); ([.B16])) -> false | G16: of:=AND([.A16]; NOT([.C16]); NOT([.D16])) -> false | H16: of:=AND([.A16];NOT([.B16]);[.C16];[.D16]) -> false | I16: 0 | K16: of:=OR([.F16:.I16]) -> false | L16: 14 | M16: of:=IF([.K16];[.L16];"") -> 
A17: 1 | B17: 1 | C17: 1 | D17: 1 | F17: of:=AND(NOT([.A17]); ([.B17])) -> false | G17: of:=AND([.A17]; NOT([.C17]); NOT([.D17])) -> false | H17: of:=AND([.A17];NOT([.B17]);[.C17];[.D17]) -> false | I17: 0 | K17: of:=OR([.F17:.I17]) -> false | L17: 15 | M17: of:=IF([.K17];[.L17];"") -> 