Sheet: Sheet1
A1: 43 | B1: 34 | C1: 32 | D1: 33 | E1: 29 | F1: 39 | G1: 40 | H1: 37 | I1: 38 | J1: 38 | K1: 29 | L1: 28 | M1: 35 | N1: 29 | O1: 37 | P1: 34 | Q1: 30 | R1: 30 | S1: 37 | T1: 40 | V1: n | W1: of:=COUNT([.A1:.T5]) -> 100 | Z1: Объем генерального набора значений
A2: 26 | B2: 33 | C2: 38 | D2: 26 | E2: 30 | F2: 32 | G2: 28 | H2: 44 | I2: 30 | J2: 35 | K2: 20 | L2: 34 | M2: 28 | N2: 34 | O2: 24 | P2: 26 | Q2: 34 | R2: 37 | S2: 36 | T2: 39 | V2: k | W2: of:=1 + 3.322 * LOG10([.W1]) -> 7.644 | Y2: of:=[.W5]/[.Y6] -> 8 | Z2: Примерное кол-во интервалов по формуле Серджеса
A3: 29 | B3: 39 | C3: 31 | D3: 33 | E3: 32 | F3: 28 | G3: 37 | H3: 32 | I3: 37 | J3: 32 | K3: 35 | L3: 39 | M3: 30 | N3: 31 | O3: 33 | P3: 38 | Q3: 39 | R3: 20 | S3: 37 | T3: 28 | V3: x_min | W3: of:=MIN([.A1:.T5]) -> 20 | Z3: Наименьшее значение
A4: 34 | B4: 37 | C4: 33 | D4: 25 | E4: 43 | F4: 32 | G4: 36 | H4: 35 | I4: 33 | J4: 28 | K4: 35 | L4: 31 | M4: 25 | N4: 38 | O4: 41 | P4: 37 | Q4: 24 | R4: 33 | S4: 42 | T4: 30 | V4: x_max | W4: of:=MAX([.A1:.T5]) -> 44 | Z4: Наибольшее значение
A5: 28 | B5: 34 | C5: 36 | D5: 26 | E5: 33 | F5: 32 | G5: 35 | H5: 43 | I5: 33 | J5: 32 | K5: 33 | L5: 31 | M5: 29 | N5: 33 | O5: 27 | P5: 44 | Q5: 33 | R5: 24 | S5: 29 | T5: 41 | V5: R | W5: of:=[.W4]-[.W3] -> 24 | Z5: Размах варьирования
V6: h | W6: of:=[.W5]/[.W2] -> 3.13971742543171 | X6: ≈ | Y6: of:=ROUND([.W6]) -> 3 | Z6: Примерный размер интервала (шаг)
V7: x_0 | W7: of:=[.W3]-[.Y6]/2 -> 18.5 | Z7: Нижняя граница начального интервала

Sheet: Sheet2
A2: x_min | B2: of:=MIN(input) -> 20 | C2: наименьшее значение
A3: h | B3: of:=[$Sheet1.Y6] -> 3 | C3: шаг
A4: n | B4: of:=COUNT(input) -> 100 | C4: общее кол-во значений
A6: Нижняя граница интервала | B6: Верхняя граница интервала | C6: Абсолютная частота | D6: Относительная частота | E6: Середина интервала | F6: Высота столбца гистограммы
A7: x[i] | B7: x[i+1] | C7: n[i] | D7: ω[i] | E7: x*[i] | F7: W[i]
A8: of:=[.E8]-[.$B$3]/2 -> 18.5 | B8: of:=[.E8]+[.$B$3]/2 -> 21.5 | C8: of:=COUNTIFS(input; ">"&[.A8]; input; "<="&[.B8]) -> 2 | D8: of:=[.C8]/[.$B$4] -> 0.02 | E8: of:=[.B2] -> 20 | F8: of:=[.D8]/[.$B$3] -> 0.00666666666666667
A9: of:=[.E9]-[.$B$3]/2 -> 21.5 | B9: of:=[.E9]+[.$B$3]/2 -> 24.5 | C9: of:=COUNTIFS(input; ">"&[.A9]; input; "<="&[.B9]) -> 3 | D9: of:=[.C9]/[.$B$4] -> 0.03 | E9: of:=[.E8]+[.$B$3] -> 23 | F9: of:=[.D9]/[.$B$3] -> 0.01
A10: of:=[.E10]-[.$B$3]/2 -> 24.5 | B10: of:=[.E10]+[.$B$3]/2 -> 27.5 | C10: of:=COUNTIFS(input; ">"&[.A10]; input; "<="&[.B10]) -> 7 | D10: of:=[.C10]/[.$B$4] -> 0.07 | E10: of:=[.E9]+[.$B$3] -> 26 | F10: of:=[.D10]/[.$B$3] -> 0.0233333333333333
A11: of:=[.E11]-[.$B$3]/2 -> 27.5 | B11: of:=[.E11]+[.$B$3]/2 -> 30.5 | C11: of:=COUNTIFS(input; ">"&[.A11]; input; "<="&[.B11]) -> 19 | D11: of:=[.C11]/[.$B$4] -> 0.19 | E11: of:=[.E10]+[.$B$3] -> 29 | F11: of:=[.D11]/[.$B$3] -> 0.0633333333333333
A12: of:=[.E12]-[.$B$3]/2 -> 30.5 | B12: of:=[.E12]+[.$B$3]/2 -> 33.5 | C12: of:=COUNTIFS(input; ">"&[.A12]; input; "<="&[.B12]) -> 24 | D12: of:=[.C12]/[.$B$4] -> 0.24 | E12: of:=[.E11]+[.$B$3] -> 32 | F12: of:=[.D12]/[.$B$3] -> 0.08
A13: of:=[.E13]-[.$B$3]/2 -> 33.5 | B13: of:=[.E13]+[.$B$3]/2 -> 36.5 | C13: of:=COUNTIFS(input; ">"&[.A13]; input; "<="&[.B13]) -> 16 | D13: of:=[.C13]/[.$B$4] -> 0.16 | E13: of:=[.E12]+[.$B$3] -> 35 | F13: of:=[.D13]/[.$B$3] -> 0.0533333333333333
A14: of:=[.E14]-[.$B$3]/2 -> 36.5 | B14: of:=[.E14]+[.$B$3]/2 -> 39.5 | C14: of:=COUNTIFS(input; ">"&[.A14]; input; "<="&[.B14]) -> 19 | D14: of:=[.C14]/[.$B$4] -> 0.19 | E14: of:=[.E13]+[.$B$3] -> 38 | F14: of:=[.D14]/[.$B$3] -> 0.0633333333333333
A15: of:=[.E15]-[.$B$3]/2 -> 39.5 | B15: of:=[.E15]+[.$B$3]/2 -> 42.5 | C15: of:=COUNTIFS(input; ">"&[.A15]; input; "<="&[.B15]) -> 5 | D15: of:=[.C15]/[.$B$4] -> 0.05 | E15: of:=[.E14]+[.$B$3] -> 41 | F15: of:=[.D15]/[.$B$3] -> 0.0166666666666667
A16: of:=[.E16]-[.$B$3]/2 -> 42.5 | B16: of:=[.E16]+[.$B$3]/2 -> 45.5 | C16: of:=COUNTIFS(input; ">"&[.A16]; input; "<="&[.B16]) -> 5 | D16: of:=[.C16]/[.$B$4] -> 0.05 | E16: of:=[.E15]+[.$B$3] -> 44 | F16: of:=[.D16]/[.$B$3] -> 0.0166666666666667